[
  {
    "id": "guide-beginner",
    "slug": "beginner-guide",
    "name": "SpiritVale Beginner Guide",
    "shortDescription": "A sourced introduction to the SpiritVale systems described by official materials.",
    "description": "A deliberately limited overview of officially confirmed SpiritVale systems for new players.",
    "status": "published",
    "verificationStatus": "partially-verified",
    "sourceIds": ["source-official-steam-store"],
    "gameVersionId": "version-unknown",
    "imageAssetIds": ["sv-guide-beginner-combat-banner", "sv-guide-beginner-adventure-banner"],
    "createdAt": "2026-08-01T00:00:00Z",
    "updatedAt": "2026-08-01T00:00:00Z",
    "lastVerifiedAt": "2026-08-01T00:00:00Z",
    "notes": "Published guide uses only confirmed official Steam statements and registered official images.",
    "guideTypeId": "guide-type-beginner",
    "summary": "Start with the SpiritVale systems that official sources currently describe, and keep unverified details out of your planning.",
    "intro": "SpiritVale is described on its official Steam page as a class-based action MMO with real-time cooperative combat. This guide introduces that confirmed foundation without inventing an opening route, recommended build, or hidden system rule.",
    "sectionIds": ["beginner-what-spiritvale-is", "beginner-confirmed-classes", "beginner-combat-and-world", "beginner-character-systems", "beginner-official-resources"],
    "sections": [
      {
        "id": "beginner-what-spiritvale-is",
        "heading": "What SpiritVale Is",
        "anchor": "what-spiritvale-is",
        "contentBlocks": [
          {
            "type": "paragraph",
            "text": "Official Steam information presents SpiritVale as a class-based action MMO with a fantasy world, real-time cooperative combat, monsters, and ruins. It also identifies the game as an Early Access release, so systems and content can continue to evolve.",
            "items": [],
            "imageAssetId": null,
            "caption": null,
            "sourceIds": ["source-official-steam-store"]
          }
        ],
        "sourceIds": ["source-official-steam-store"]
      },
      {
        "id": "beginner-confirmed-classes",
        "heading": "Confirmed Base Classes",
        "anchor": "confirmed-classes",
        "contentBlocks": [
          {
            "type": "paragraph",
            "text": "Official Steam material confirms seven base classes. The separate Class Guide lists their verified names and deliberately omits roles, weapons, and stat recommendations until they have a first-party source.",
            "items": [],
            "imageAssetId": "sv-guide-beginner-combat-banner",
            "caption": "Official SpiritVale combat artwork used as a visual reference for the guide.",
            "sourceIds": ["source-official-steam-store"]
          }
        ],
        "sourceIds": ["source-official-steam-store"]
      },
      {
        "id": "beginner-combat-and-world",
        "heading": "Combat and World Content",
        "anchor": "combat-and-world",
        "contentBlocks": [
          {
            "type": "paragraph",
            "text": "The official store description mentions cooperative combat and a multiplayer party system. It also describes world exploration, monsters, bosses, biomes, and dungeons, but it does not provide a verified first-play route for a new character.",
            "items": [],
            "imageAssetId": null,
            "caption": null,
            "sourceIds": ["source-official-steam-store"]
          }
        ],
        "sourceIds": ["source-official-steam-store"]
      },
      {
        "id": "beginner-character-systems",
        "heading": "Character Systems Mentioned by Official Sources",
        "anchor": "character-systems",
        "contentBlocks": [
          {
            "type": "paragraph",
            "text": "Official Steam information refers to character leveling, skill progression, equipment, cards, artifacts, loot, and character customization. It does not establish a best early build, a stat allocation, or a mandatory equipment path, so this guide does not recommend one.",
            "items": [],
            "imageAssetId": "sv-guide-beginner-adventure-banner",
            "caption": "Official SpiritVale adventure artwork used as a general visual reference.",
            "sourceIds": ["source-official-steam-store"]
          }
        ],
        "sourceIds": ["source-official-steam-store"]
      },
      {
        "id": "beginner-official-resources",
        "heading": "Official Resources",
        "anchor": "official-resources",
        "contentBlocks": [
          {
            "type": "callout",
            "text": "Use the official Steam page for current store information and official updates. This site adds detail only when it can link that detail to a registered first-party source.",
            "items": [],
            "imageAssetId": null,
            "caption": null,
            "sourceIds": ["source-official-steam-store"]
          }
        ],
        "sourceIds": ["source-official-steam-store"]
      }
    ],
    "faqItems": [
      {
        "id": "beginner-faq-game-type",
        "question": "What type of game is SpiritVale?",
        "answer": "The official Steam page describes SpiritVale as a class-based action MMO with real-time cooperative combat.",
        "sourceIds": ["source-official-steam-store"]
      },
      {
        "id": "beginner-faq-classes",
        "question": "How many base classes are officially confirmed?",
        "answer": "Official Steam material lists seven base classes.",
        "sourceIds": ["source-official-steam-store"]
      },
      {
        "id": "beginner-faq-updates",
        "question": "Where should players check official information?",
        "answer": "The registered official Steam page is the current first-party reference used by this guide.",
        "sourceIds": ["source-official-steam-store"]
      }
    ],
    "relatedGuideIds": ["guide-classes", "guide-leveling", "guide-stats"],
    "relatedClassIds": ["class-acolyte", "class-mage", "class-summoner", "class-knight", "class-warrior", "class-scout", "class-rogue"],
    "relatedDatabaseCategoryIds": ["equipment", "bosses", "maps"],
    "relatedBuildIds": [],
    "relatedSkillIds": [],
    "relatedEquipmentIds": [],
    "relatedCardIds": [],
    "relatedArtifactIds": [],
    "relatedBossIds": [],
    "relatedMonsterIds": [],
    "relatedMapIds": [],
    "editorialStatus": "published",
    "factReviewStatus": "partially-verified",
    "reviewedAt": "2026-08-01T00:00:00Z",
    "seo": {
      "title": "SpiritVale Beginner Guide — Essential Systems and First Steps",
      "description": "Learn the officially confirmed basics of SpiritVale, including classes, progression, combat, equipment, cards and world content.",
      "canonicalPath": "/guides/beginner-guide/",
      "index": true
    }
  },
  {
    "id": "guide-classes",
    "slug": "class-guide",
    "name": "SpiritVale Class Guide",
    "shortDescription": "The verified names of SpiritVale's seven base classes and the limits of current class information.",
    "description": "A source-led guide to the confirmed base class roster.",
    "status": "published",
    "verificationStatus": "partially-verified",
    "sourceIds": ["source-official-steam-store"],
    "gameVersionId": "version-unknown",
    "imageAssetIds": ["sv-guide-classes-selection-banner", "sv-guide-classes-customization-banner"],
    "createdAt": "2026-08-01T00:00:00Z",
    "updatedAt": "2026-08-01T00:00:00Z",
    "lastVerifiedAt": "2026-08-01T00:00:00Z",
    "notes": "Class names and base-class status are backed by the official Steam store; unverified class attributes are omitted.",
    "guideTypeId": "guide-type-classes",
    "summary": "Explore the seven confirmed base class names without treating unverified roles, weapons, stats, or builds as fact.",
    "intro": "The official Steam page names seven base classes and refers to skill trees and advanced specializations. It does not provide enough first-party detail for this guide to assign a role, weapon, difficulty, or best build to any individual class.",
    "sectionIds": ["classes-system-overview", "classes-seven-base-classes", "classes-official-progression-language", "classes-what-is-not-verified"],
    "sections": [
      {
        "id": "classes-system-overview",
        "heading": "Class System Overview",
        "anchor": "class-system-overview",
        "contentBlocks": [
          {
            "type": "paragraph",
            "text": "SpiritVale's official Steam page describes the game as class-based and states that its current version includes seven base classes. The page also refers to distinct skill trees and advanced jobs, but the exact relationship between every base class and later specialization is not fully documented in this data set.",
            "items": [],
            "imageAssetId": "sv-guide-classes-selection-banner",
            "caption": "Official SpiritVale class-selection artwork used as a general class-system visual.",
            "sourceIds": ["source-official-steam-store"]
          }
        ],
        "sourceIds": ["source-official-steam-store"]
      },
      {
        "id": "classes-seven-base-classes",
        "heading": "The Seven Confirmed Base Classes",
        "anchor": "seven-base-classes",
        "contentBlocks": [
          {
            "type": "class-list",
            "text": "These names are read from the formal SpiritVale class data, which records them as confirmed base classes.",
            "items": [],
            "imageAssetId": null,
            "caption": null,
            "sourceIds": ["source-official-steam-store"]
          }
        ],
        "sourceIds": ["source-official-steam-store"]
      },
      {
        "id": "classes-official-progression-language",
        "heading": "Skill Trees and Advanced Specializations",